# name: test/sql/local/attach_update_table
# description: Test UPDATE statement on tables
# group: [local]

require bigquery

require-env BQ_API_ENDPOINT

require-env BQ_GRPC_ENDPOINT

statement ok
ATTACH 'project=test api_endpoint=${BQ_API_ENDPOINT} grpc_endpoint=${BQ_GRPC_ENDPOINT}' AS bq (TYPE bigquery)

statement ok
DROP TABLE IF EXISTS bq.dataset1.test_update;

statement ok
CREATE TABLE bq.dataset1.test_update(i INTEGER, s VARCHAR, n VARCHAR);

statement ok
INSERT INTO bq.dataset1.test_update VALUES (1, 'hi', 'y'), (2, 'hello', 'y'), (3, 'moin', 'y');

statement ok
UPDATE bq.dataset1.test_update SET i=i+1 WHERE i>1;

query III
SELECT * FROM bq.dataset1.test_update;
----
1	hi	y
3	hello	y
4	moin	y

statement ok
UPDATE bq.dataset1.test_update SET i=i+100 WHERE s='hi';

query III
SELECT * FROM bq.dataset1.test_update;
----
101	hi	y
3	hello	y
4	moin	y

statement ok
UPDATE bq.dataset1.test_update SET s='hello' WHERE s='hi';

statement ok
UPDATE bq.dataset1.test_update SET n='another string' WHERE i<100 AND s='hello';

query III
SELECT * FROM bq.dataset1.test_update;
----
101	hello	y
3	hello	another string
4	moin	y
