# name: test/sql/local/attach_update_table.test
# description: Test UPDATE statement on tables
# group: [local]

require bigquery

require-env BQ_API_ENDPOINT

require-env BQ_GRPC_ENDPOINT

statement ok
ATTACH 'project=test api_endpoint=${BQ_API_ENDPOINT} grpc_endpoint=${BQ_GRPC_ENDPOINT}' AS bq (TYPE bigquery)

statement ok
DROP TABLE IF EXISTS bq.dataset1.test_update;

# multi column update in different orders
statement ok
CREATE TABLE bq.dataset1.test_update(i INTEGER, j INTEGER, k INTEGER);

query I
INSERT INTO bq.dataset1.test_update VALUES (1, 10, 100), (2, NULL, 200), (3, 30, NULL), (4, 40, 400);
----
4

query III
SELECT * FROM bq.dataset1.test_update ORDER BY 1
----
1	10	100
2	NULL	200
3	30	NULL
4	40	400

statement ok
UPDATE bq.dataset1.test_update SET k=990 + i, i=i, j=99 WHERE i=2 OR i=4

query III
SELECT * FROM bq.dataset1.test_update ORDER BY 1
----
1	10	100
2	99	992
3	30	NULL
4	99	994

# duplicates in SET statements
statement error
UPDATE bq.dataset1.test_update SET j=k, j=i
----
Multiple assignments to same column
