# name: test/sql/local/attach_delete_from_table.test
# description: Test DELETE statement on tables
# group: [local]

require bigquery

require-env BQ_API_ENDPOINT

require-env BQ_GRPC_ENDPOINT

statement ok
ATTACH 'project=test api_endpoint=${BQ_API_ENDPOINT} grpc_endpoint=${BQ_GRPC_ENDPOINT}' AS bq (TYPE bigquery);

statement ok
DROP TABLE IF EXISTS bq.dataset1.test_delete;

statement ok
CREATE TABLE bq.dataset1.test_delete(i INTEGER, s VARCHAR, n VARCHAR);

statement ok
INSERT INTO bq.dataset1.test_delete VALUES (1, 'hi', 'y'), (2, 'hello', 'y'), (3, 'moin', 'y');

statement ok
DELETE FROM bq.dataset1.test_delete WHERE s='hello';

query III
SELECT * FROM bq.dataset1.test_delete;
----
1	hi	y
3	moin	y

statement ok
DELETE FROM bq.dataset1.test_delete WHERE i>1 AND s='hi';

query III
SELECT * FROM bq.dataset1.test_delete;
----
1	hi	y
3	moin	y

statement ok
DELETE FROM bq.dataset1.test_delete WHERE i<=1 AND s='hi';

query III
SELECT * FROM bq.dataset1.test_delete;
----
3	moin	y

statement ok
INSERT INTO bq.dataset1.test_delete VALUES (3, 'moin', 'y');

statement ok
INSERT INTO bq.dataset1.test_delete VALUES (3, 'moin', 'y');

statement ok
INSERT INTO bq.dataset1.test_delete VALUES (3, 'moin', 'y');

statement ok
DELETE FROM bq.dataset1.test_delete WHERE i=3;

query III
SELECT * FROM bq.dataset1.test_delete;
----
